{
  "schemaVersion": 1,
  "purpose": "dsh-alpha1-hosted-plugin-adaptation",
  "catalogId": 3040,
  "slug": "dsh-kanban",
  "baseline": {
    "tag": "dsh-v0.1.2-alpha.1",
    "commit": "cd5ef8148158c3a752a658978873241fdf8e2bbc",
    "tree": "a712eec535b48badc4fefb4df5176a7002e4280b"
  },
  "source": {
    "repository": "https://github.com/Ericwong5021/dsh-kanban.git",
    "commit": "f7fa24c14db47ee4827cad5c827ad7aa3fd13434",
    "tree": "322fe7f98155d8cee98918f235ce4602ffe3cbc3",
    "sourceSubdir": ".",
    "manifestSha256": "e2a91d09eb4978e2ac75e9e742044e57f39e37015b08a4867114e2f19171dbf8",
    "packageName": "dsh-kanban",
    "packageVersion": "0.1.1",
    "bundlePatch": "cordis.patch.yml"
  },
  "output": {
    "packageName": "@dsh-themes/dsh-kanban",
    "packageVersion": "0.1.1-dsh.alpha1.1",
    "description": "Five-column live session planning board using only standard DeepSeek Harness 0.1.2-alpha.1 Web surfaces",
    "assetName": "dsh-kanban-0.1.1-dsh.alpha1.1.tgz",
    "hostEntry": "lib/index.js",
    "clientEntry": "lib/client.js",
    "bundlePatch": "cordis.patch.yml",
    "clientInject": [
      "@deepseek-ai/dsh-api-session-controller",
      "@deepseek-ai/dsh-client-locale",
      "@deepseek-ai/dsh-client-ui-layout",
      "@deepseek-ai/dsh-client-ui-renderer",
      "@deepseek-ai/dsh-client-ui-session",
      "@deepseek-ai/dsh-client-ui-sidebar"
    ],
    "peerDependencies": {
      "@deepseek-ai/cordis": "4.0.1",
      "@deepseek-ai/dsh-api-session-controller": "0.1.2-alpha.1",
      "@deepseek-ai/dsh-client-locale": "0.1.2-alpha.1",
      "@deepseek-ai/dsh-client-ui-layout": "0.1.2-alpha.1",
      "@deepseek-ai/dsh-client-ui-renderer": "0.1.2-alpha.1",
      "@deepseek-ai/dsh-client-ui-session": "0.1.2-alpha.1",
      "@deepseek-ai/dsh-client-ui-sidebar": "0.1.2-alpha.1",
      "react": "18.3.1"
    },
    "files": [
      {
        "outputPath": "lib/index.js",
        "input": {
          "kind": "reviewed-replacement",
          "sourcePath": "src/index.ts",
          "sourceSha256": "88e6c394e8980a82a76acb0a22c26b8b846336ab83fce23d7fdf03eac9ee727b",
          "replacementPath": "assets/hosted-adaptations/3040/lib/index.js",
          "replacementSha256": "43d3f98dee355324a3886db9df7d801911f31858e92c105eec336897c4bc6115"
        }
      },
      {
        "outputPath": "lib/client.js",
        "input": {
          "kind": "reviewed-replacement",
          "sourcePath": "src/client/Kanban.tsx",
          "sourceSha256": "871a37d663af144372339c5290f1a55322eeb26a0171d4b096de6f77a4577b3e",
          "replacementPath": "assets/hosted-adaptations/3040/lib/client.js",
          "replacementSha256": "dc634deb6e887dcef99c598196b5ffdf32fd28122a08b3b349ff22f350995c94"
        }
      },
      {
        "outputPath": "cordis.patch.yml",
        "input": {
          "kind": "reviewed-replacement",
          "sourcePath": "cordis.patch.yml",
          "sourceSha256": "929ab1a18725d614ecc83c2a54d2f7303c900ba582413eba2e70efc822c338e8",
          "replacementPath": "assets/hosted-adaptations/3040/cordis.patch.yml",
          "replacementSha256": "7a94f76274b185b24a2f637049fb9d2c5d49414bd89840d313c600cbac1772a1"
        }
      },
      {
        "outputPath": "LICENSE",
        "input": {
          "kind": "copy-exact-upstream",
          "sourcePath": "LICENSE",
          "sha256": "cbc550d2e5a273ed1ad52ea1f4a9dbc991032bed8bc3203e8f81f6f72cd9b6f2"
        }
      }
    ]
  },
  "rights": {
    "licenseExpression": "MIT",
    "licensePath": "LICENSE",
    "licenseSha256": "cbc550d2e5a273ed1ad52ea1f4a9dbc991032bed8bc3203e8f81f6f72cd9b6f2",
    "copyrightNotice": "Copyright (c) 2026 Ericwong5021",
    "redistribution": "allowed-with-license-and-modification-notice"
  },
  "staticPolicy": {
    "computedMembers": [],
    "forbiddenUtf8": [
      "@deepseek-ai/dsh-client-runtime",
      "@deepseek-ai/dsh-host-apiproxy",
      "ctx.webServer",
      "ctx.connection",
      "ctx.remote",
      "ctx.workspaces",
      "ctx.uiWorkspace",
      "window.location",
      "history.",
      "data-conversation-scroll",
      "createPortal",
      "fetch(",
      "XMLHttpRequest",
      "WebSocket",
      "EventSource",
      "localStorage",
      "sessionStorage",
      "document.cookie",
      "innerHTML",
      "outerHTML",
      "insertAdjacentHTML",
      "dangerouslySetInnerHTML",
      "node:child_process",
      "node:fs",
      "process.env",
      "eval(",
      "new Function"
    ],
    "requiredUtf8": [
      "window.__ModuleLoader__.load",
      "const inject = ['slots', 'sessions', 'locale']",
      "props.useSessions(function (state) { return state })",
      "props.useSessionPendingInteraction(function (state) { return state })",
      "ctx.sessions.open(sessionId)",
      "ctx.sessions.clear()",
      "ctx.slots.inject('sidebar.footer.action'",
      "ctx.slots.inject('shell.overlay'",
      "ctx.locale.register(NS, { zh, en })",
      "DSH3040_PROBE:KANBAN_FIVE_COLUMNS_V1",
      "DSH3040_PROBE:EPHEMERAL_MOVES_V1",
      "DSH3040_PROBE:DISPOSE_CLEAN_V1"
    ]
  },
  "runtimeProbe": {
    "contractPath": "references/plugin-runtime-probes/3040.json",
    "contractSha256": "afa31e967227e0643722f44e0471d4c20495927dd3914378e3d793cc0aa0f16c",
    "requiredAssertions": [
      "package.exact-entry",
      "boot.ready-context-once",
      "feature.five-column-kanban",
      "feature.ephemeral-idle-move",
      "security.session-navigation-only",
      "ui.keyboard-zoom-themes",
      "dispose.zero-residue",
      "combine.additive-slots-rollback"
    ]
  }
}
